{
  "$schema": "./project-status.schema.json",
  "schemaVersion": 2,
  "updated": "2026-08-26",
  "release": {
    "rust": "0.7.0"
  },
  "toolchain": {
    "rust": "1.87"
  },
  "archive": {
    "writes": {
      "formatVersion": 3,
      "directoryVersion": 6
    },
    "reads": {
      "formatVersions": [2, 3],
      "directoryVersions": [5, 6]
    }
  },
  "commands": [
    { "name": "stt-build", "support": "stable" },
    { "name": "stt-optimize", "support": "stable" },
    { "name": "stt-validate", "support": "stable" },
    { "name": "stt-bundle", "support": "preview" },
    { "name": "stt-serve", "support": "preview" }
  ],
  "repositoryOnlyCommands": [
    { "name": "stt-generate", "support": "experimental" }
  ],
  "otherSurfaces": [{ "name": "stt-wasm", "support": "experimental" }]
}
